{
  "schema_version": "1.0.0",
  "proposal_id": "proposal_launch_1",
  "title": "产品发布准备",
  "objective": "形成经过验证的产品发布方案",
  "overall_acceptance_criteria": ["最终交付物引用全部上游证据"],
  "coordinator_agent_id": "ai-product-manager",
  "nodes": [
    {
      "node_id": "research",
      "role": "executor",
      "goal": "整理发布输入",
      "suggested_agent_id": "ai-product-manager",
      "required_capabilities": ["local-file-operations"],
      "input_refs": [],
      "acceptance_criteria": ["输出经过验证的 Markdown 文件"],
      "budget": {"max_input_tokens": 4000, "max_output_tokens": 2000, "max_tool_rounds": 4, "max_elapsed_ms": 120000},
      "failure_policy": "stop"
    },
    {
      "node_id": "draft",
      "role": "executor",
      "goal": "根据研究输入形成发布草案",
      "suggested_agent_id": "ai-product-manager",
      "required_capabilities": ["local-file-operations"],
      "input_refs": [],
      "acceptance_criteria": ["输出结构完整的发布草案"],
      "budget": {"max_input_tokens": 4000, "max_output_tokens": 2000, "max_tool_rounds": 4, "max_elapsed_ms": 120000},
      "failure_policy": "stop"
    },
    {
      "node_id": "finalize",
      "role": "finalization",
      "goal": "汇总最终发布方案",
      "suggested_agent_id": "ai-product-manager",
      "required_capabilities": ["local-file-operations"],
      "input_refs": [],
      "acceptance_criteria": ["引用研究与草案节点的 verified Deliverable"],
      "budget": {"max_input_tokens": 4000, "max_output_tokens": 2000, "max_tool_rounds": 2, "max_elapsed_ms": 120000},
      "failure_policy": "stop"
    }
  ],
  "edges": [
    {"predecessor_node_id": "research", "successor_node_id": "draft", "required": true},
    {"predecessor_node_id": "draft", "successor_node_id": "finalize", "required": true}
  ],
  "assumptions": [],
  "risks": [],
  "questions_for_user": []
}
